Summary,Severity
"Edges of characters are clipped in Bookmarks Toolbar, after hovering, with lightweight theme that uses text-shadow",normal
Bookmark validator should ignore title field for default bookmarks.,normal
Expanded tag box in Library not updated when bookmark selected,normal
Search keyword adding bugged for rutracker.org,normal
Implement bookmarks.onChildrenReordered WebExtensions API event,normal
Many users report unable to restore bookmarks from backups,major
"location bar autocompletes bookmarked sites when ""suggest bookmarks"" is unchecked",normal
There is no confirmation dialog after completing bookmark importing/exporting task and when it's still going on during browser shutdown,normal
Automatically organize Other Bookmarks when there are too many children,normal
UTF-8 characters wrongly encoded as %u1234 in keyword search bookmark URL,normal
"QUERY_FIND_EXOTIC_VISITS_TO_EXPIRE has unintended side effect to the ""Remember history"" setting",normal
Recently bookmarked bookmarks in bookmarks panel don't update when I drop new url,normal
(e10s-specific) [Hang tab] Bookmarks toolbarbutton creates duplicate bookmarks if content process hangs a bit,normal
Bookmarks panel displays wrong info if page navigates from one bookmarked url to another (UI is misleading),normal
Closed tabs w/o favicon only display default favicon in history panel if it was the first visit of the site in session,normal
"Ctrl+Shift+H opens history, not today history if Library is already open",normal
Input fields at the bottom of history/bookmarks library aren't in sync with selected item,normal
"Tags field in ""New bookmark"" panel stays forever focused (illogical behavior)",normal
Urlbar suggestions don't show some history items (no way to get rid of autofill by deleting suggestions),normal
Personal (bookmarks) toolbar lacks a keyboard shortcut to show/hide the bar  (ideally same as Chrome),normal
Syncing large amount of bookmarks takes forever,normal
"""Page Bookmarked"" panel won't disappear",normal
history list forgets selection when deleting many elements,normal
"""Open All in Tabs"" should be unavailable when opening context menu on Recently Bookmarked section header and on other non-bookmark items (in both the main bookmarks menu and the bookmarks toolbar button menu)",normal
"about:privatebrowsing should mentiong that sync will still run, and sync bookmarks/passwords/etc",normal
Store and upload tombstones for deleted bookmarks,normal
"Bookmark keyword field accepts keywords with invalid characters (spaces,colons) but doesn't work - should display an error/prevent them",normal
Firefox Sync should sync POST_DATA of bookmarks,normal
Design and implement a better bookmarks API,normal
Fade instead dots in labels on bookmarks titles,normal
[meta] Sync sometimes reorders bookmarks,normal
Edge bookmarks/reading list migration should convert read: Edge reader mode URLs,normal
Speculatively connect to bookmarked sites on mousedown,normal
Stop storing a separate title field for all the bookmarks,normal
Consider running validation only for users with <= 1k local bookmarks,normal
1.15ms uninterruptible reflow at updateOverflowStatus@chrome://browser/content/places/browserPlacesViews.js:1163:1,normal
"Stop fetching icons from the Places backend, just make the frontend use page-icon: protocol",normal
Bookmarked favicons blinking on next bookmarks visit after landing patches from bug #977177,major
1.0ms uninterruptible reflow at PT__onDragOver@chrome://browser/content/places/browserPlacesViews.js:1600:11,normal
Showing the bookmarks panel is too slow the first time,normal
Make multiple bookmarks (or bookmark folders) draggable outbounds from library,normal
A page using HSTS won't be shown as bookmarked if the bookmark has the unsecure url,normal
Not all bookmark favicons are displayed after importing bookmarks from HTML,normal
removing bookmarks from tags list,normal
Deleting a container should clear history associated to it,normal
Sync Corrupts Bookmarks,normal
Impossible to close Bookmarks Properties dialog using [Cancel] if it is open in two windows at the same time,trivial
"excessive space between "" sidebar icon""  & ""View History sidebar""",normal
"Update the Bookmarks menu popup to re-append the controller, instead of using listeners",normal
"Favicon handling - problems with erroneous icon in bookmarks, embedded base64 handling and tab labelling (Nightly)",normal
bookmark tags icons are reset when clicking a button LoL,normal
Bookmark toolbar is very slow to render if there are many bookmarks,normal
INTERMITTENT: Saving bbcamerica.com bbc.com cnn.com and abv.bg to the toolbar sometimes get lost or moved to the bookmarks folder,normal
Bookmarks sidebar should support showing a single folder,normal
Clicking bookmark star doesn't always show edit panel,normal
"Investigate merging ""Bookmarks Menu"" with ""Other Bookmarks""?",normal
Figure out what do to with canDrop() with respect to sync vs async,normal
List no default bookmarks at all,normal
Opening the bookmarks menu can be slow,normal
It takes time to change the state of the menu Undo (Ctrl+Z) in Library,normal
Bookmarks panel doesn't refresh when leaving Settings after Sign in with sync completed,normal
"Sync/Bookmarks: ""Open all in tabs"" loads everything at once",normal
Bookmarks Panel displayed when refreshing History/Top sites Panel,normal
There is an entry In the history menu I did not visited a long time ago,normal
Bookmarks and history opened in a popup window should open in the main browser,normal
Bookmarks system menu loads icons in a second paint after the menu is displayed.,normal
Opening a site from the Library > History window replaces one of my open tabs in a different window,normal
"Library window has invalid ""Visit Counts"" when viewing History list",normal
The first PlacesUtils.bookmarks.fetch call does main thread IO to initialize the places db connection,normal
"Update ""Organize"" & ""Views"" & ""Import and Backup"" & ""Search Bookmarks"" & ""Cancel Search Bookmarks"" buttons icons in ""Library"" window to Photon specific ones",normal
Pressing TAB does not give full-focus to bookmarks list in sidebar,minor
"When opening ""Bookmark all tabs"" dialog, the folder field flickers - shows one value and then changes",normal
Bad performance browser.bookmarks.getChildren on folders with subfolders containing many bookmarks,normal
Inconsistent paste options in context menu when pasting items,minor
favicons flicker in the bookmarks menu on Mac,normal
"bookmarks.onChanged ChangeInfo only includes either the url or title, but not both",normal
The bookmark toolbar drop indicator jumps to the end when dragging to a position immediately between two bookmarks,normal
Work needed to enable browser.bookmarks.openInTabClosesMenu by default,normal
Impossible to remove bookmarks as part of Clean Profile,normal
"Bookmarks...""Open all in tabs"" should provide way to open in container tabs",normal
Incorrect tab order when opening a bookmarks folder in tabs,normal
"The ""Bookmarks Toolbar"" option from the customize panel is offset in full screen mode",normal
"Bookmarks from the Library panel should be moved, not copied",normal
"Recent bookmarks are not immediately cleared after tapping ""Remove Bookmark"" or ""Remove""",normal
Remove `_defaultSort` from the bookmarks engine,normal
Bookmark editor first edit field doesn't get set to tagsField unless the tags field is manually blurred after change,normal
Auto-migration should auto-show the bookmark toolbar if some bookmarks were imported there,normal
"browser.bookmarks.update throws error Error: Invalid bookmark: {""guid"":""ppPF1p3gENdk""}",normal
"Don't show ""Bookmark This Page"" for bookmarks in the remote Mobile Bookmarks folder",normal
[SUMO User Trending issue] Bookmarks missing after update in 56 encryption change,normal
Bad window height set when bookmarks toolbar is open with resistfingerprinting option,normal
Export mobile bookmarks when exporting as HTML,normal
Consider changing bookmarks.update to apply transactions to multiple bookmarks to aid performance,normal
"Top Sites settings does not make it clear that ""Recent bookmarks"" and ""Visited"" change Highlights section",normal
"Move the code that populates the ""Recent Highlights"" section out of panelUI.js",normal
"Standardize default target folder also for ""Bookmark This Link"" and Bookmark this frame",normal
Bookmarks created from Reader Mode don't show up in Highlights,normal
firefox quantum: lost all bookmarks and unable to read backup,normal
Context and main menus in the library / bookmarks/history manager window don't get extra padding when opened via touch,normal
Consider where bookmarks are imported to when importing HTML,normal
Consider progress indication for bookmarks import/export/backup/restore,normal
Use defineLazyModuleGetters more often with PlacesUtils,normal
this.node is null PanelMultiView.jsm:140 when closing Bookmarks panel in Library button,normal
Bookmarks and history sidebars and both address bars don't respect preference to open new tabs in background; they always open tabs in foreground/selected,normal
PlacesToolbar updateNodesVisibilityTimer should use promiseDocumentFlushed,normal
"Add automated test for ""The items from the Bookmarks Toolbar can be sorted by name""",normal
Add a test for DND in Places menus,normal
"Remove ""tree"" from the Library window and the sidebar",normal
"Remove ""tree"" from the Edit Bookmark panel",normal
Remove nsNavBookmarks::GetBookmarkURI,normal
Remove the non-mirror bookmarks engine,normal
"Visited Unicode domain names cannot be searched in ""Search History"" in ""Show all history""",normal
Bookmarks folder can't be set as Start Page,normal
"Opening ""History"" and ""Bookmarks"" subitems in ""Library"" item causes menu tearing after landing patches from bug #1356317",major
Create separator on top (instead of middle) after multiple bookmarks are selected,minor
Recent Highlights ignore browser.tabs.loadBookmarksInTabs,normal
Investigate if we can remove itemId (aka parentId) from PlacesInsertionPoint,normal
[meta] Bookmark doorhanger refresh,normal
Adding an horizontal separator in a new folder from the bookmark toolbar makes the folder unusable,normal
bookmark position changes,normal
Bookmarks toolbar user-created button shows (Empty) instead of tagged bookmarks,normal
"Intermittent browser/components/places/tests/browser/browser_toolbar_overflow.js | The bookmark node should be visible - """" == ""visible"" - JS frame :: chrome://mochitests/content/browser/browser/components/places/tests/browser/browser_toolbar_overflow.js",normal
browser.tabs.loadBookmarksInTabs doesn't work for smart bookmarks,normal
Let PlacesCommandHook.bookmarkLink open a doorhanger instead of a modal dialog,normal
Folder dropdown section is unusable if it’s expanded again right after a New Folder was created inside the “New Bookmark” dialog,S3
"Bookmark sync never completes, sync icon keeps spinning, bookmarks UI stops functioning and browser hangs at shutdown",normal
Import Chrome's mobile bookmarks when running migration,normal
Race condition in opening the bookmarking popup,normal
Extension menu item in menu on bookmarks toolbar disappears when a submenu is opened,normal
"Dynamically create the ""sidebar"" <browser> when it's needed",normal
"Bookmarks Menu icon disappears in toolbar after clicking ""add Bookmarks Menu to toolbar""",normal
moz-phab is forgetting commit tags and bookmarks,normal
Bookmark star and confirmation animations are played at the same time,normal
Unable to delete a tag: Empty array passed for required input property: urls,normal
Failed to initialize dialog: Error: Cannot use an incomplete node to initialize the edit bookmark panel,normal
Add search shortcuts for bookmarks and open tabs,normal
The bookmark vertical separators are very difficult to select on Mac platform,S3
The new bookmark dialog should use the preview image instead of thumbnail,normal
Replace nsINavBookmarksService::onItemMoved with bookmark-item-moved,normal
Remove onItemVisited notification from Places' bookmarks,normal
Switch to tab does not work for specific links on Bookmarks panel,normal
"Bookmarks Menu toolbar button has notable delay, depending on the number of bookmark items",normal
Bookmarks saved for non-secure sites (http) don't show for secure (https) sites,normal
Fix exception when Bookmarks sidebar is shown and quickly hidden before it finishes loading,normal
New Bookmark option is available inside Tags from Bookmarks Toolbar and returns an empty dialog box,normal
browser.bookmarks.create is orders of magnitude slower than on Chromium,normal
Recent bookmarks cannot be Cut and Pasted,normal
New folder input field in bookmarks doorhanger is vertically too narrow,normal
New tab page - pinned sites sync between machines even when history and bookmarks aren't synced,normal
Bookmark Favicons for some sites do not show unless 'remember history' on.,normal
check origin of dropped data when it contains Places flavors,normal
"Don't log ""0 outgoing items pre-reconciliation"" in the new bookmarks engine",normal
Delete key has no effect on deleting bookmark entry,normal
Consider building the about:library content page,normal
History entries opened in new tabs should stay in the current container,normal
bookmarks.onRemoved event arguments have incorrect values,normal
Problem with 'index' property of bookmarks while creating new bookmarks using Firefox WebExtensions API,normal
"Top Sites is displayed instead of Bookmarks, when returning from Recent Apps",normal
Sync just removed all the keywords for my search-keyword bookmarks,normal
Bookmark with invalid URL prevents any bookmarks from syncing,normal
Entering Bookmark tags is unresponsive,normal
"The Top sites , Bookmarks & History are not centered correctly on high resolution devices",normal
Library sorts by Location on sorting by Name on unnamed bookmarks,normal
Bookmark views don't immediately remove bookmarks with invalid urls,normal
Consider storing the bookmarks mirror as a JSON file instead of a SQLite DB,normal
Focus does not remain on a bookmark that's moved inside bookmark manager (library or sidebar),normal
Container escape by wheelclick/ctrl+click on bookmarklet with javascript:document.location,normal
Crash in [@ AsyncShutdownTimeout | Places Clients shutdown | SyncedBookmarksMirror: finalize],normal
Fix handling of duplicate and missing child GUIDs in the bookmarks mirror,normal
"Unexpected autofilled entries for ""place:"" and ""about:"" bookmarked uris",normal
Return bookmark paths in PlacesUtils.bookmarks.fetch,normal
bookmarks.search() doesn't work for a query string containing URLencoded chars,normal
Bookmarks & History: extremely slow back/forward navigation,normal
"URL is not displayed in status bar when hovering over bookmarks in bookmarks menu, but it is OK when hovering over bookmarks located in a folder within bookmarks menu.",S3
Redesign the history views,normal
Bookmarks menu incorrectly sized on some secondary display topologies,normal
Bookmarks folder name doesn't match with the list after renaming it,normal
Dragging a folder shortcut on the toolbar duplicates the shortcut,normal
Ctrl-Shift-Z in bookmarks sidebar opens debugger instead of redoing changes,normal
Syntax errors in `SyncedBookmarksMirror.jsm` due to on-disk corruption,normal
Bookmarks search - unsorted results order,normal
Bookmarks should ignore refs/anchors,normal
‌[macOS] Improve visibility of the separators on bookmarks toolbar when in dark theme,normal
The New folder input field is overextended if previously a long title one was created,normal
Implement the |bookmarks| API,normal
Pasted URLs Do Not Show Until Folder is Revisited,S3
Fix the vertical alignment of the bookmarks toolbar drag&drop indicator,S4
endless loop with a nested Unfiled Bookmarks shortcut,S3
Tags removed by API call bookmarks.update() when changing URL,S3
Issue with drag & drop a tab,S3
Investigate importing Edgium's collections as bookmarks,S3
Only update the bookmark menu labels when menu panel is shown to avoid busy-work,S3
Open options from the context menu doesn't dismiss the bookmarks doorhanger in some cases,S3
Go to download page option active in Library for some downloaded files,normal
Up and down arrows displayed in Bookmarks menu even when it is impossible to scroll,minor
"Not possible to remove ""Home"" text label from the new Home icon on bookmarks toolbar",normal
Certain icons disappear in Bookmarks Toolbar when no browser window is focused,normal
Changed Tag name doesn't sync,normal
Better handling of conflicting records,normal
"Show new types of bookmarks (separator, livemark, and query) where applicable",normal
"UITour: showMenu(""bookmarks"") opens the submenu instead of the subview in the menu panel",normal
The search panel appears above the bookmarks panel,normal
"Add ""View Pocket List"" to bookmarks sidebar?",normal
Update the bookmarks menu button panel/menu to match photon styling better,trivial
Bookmarks and History subview scrollbar flickers(width changes) while scrolling by mouse,normal
Make bookmarks toolbar items blend in better in the overflow panel,normal
Animation for when bookmarks are removed,normal
Icon of bookmarks toolbar dropzone has no vertical margin,normal
Optimize Bookmarks menu for touch,normal
Optimize Bookmarks Toolbar folder menus for touch,normal
Optimize bookmarks toolbar overflow menu for touch,normal
Add the keyboard shortcut affordance for bookmarks to the PAM,normal
Policy for Deleting Bookmarks,normal
Make keyword bookmarks create new engine,S3
Migrate existing keyword bookmarks,S3
Export bookmarks and history,normal
Bookmarks menu missing when the Bookmarks window has focus,minor
Location bar autocomplete should include / prefer bookmarked URLs and names of bookmarks,normal
Come up with a better way to disable JS and data urls in history,normal
"if a bookmark fails to load, try to find a previous redirect target for it in history",normal
Search/find won't find text in the Description column,normal
Option for Bookmarks Merge on Import,normal
support inline editing of bookmark values,normal
"""A > Z Sort Order"" label is confusing",normal
paste menu item is disabled but I can still paste,normal
should be able to rename bookmark items with pressing F2,normal
make sorting changes in places/library (session) persistent,minor
Availability to use different column sets for special folders in Library,normal
when sorting by name in the Library put folders before bookmarks,normal
Favicons are not affected by a hard refresh,normal
Support diagonal dragging through bookmarks menus (was:Bookmarks submenu is closed immediately during dragging),normal
Add bookmark dialog: Two folders/directories with same name not distinguishable in quick list,normal
No tooltip for folders on bookmark toolbar,normal
Add a folder column to search results for bookmarks in the library,normal
"Add ""Open Enclosing Folder"" context menu to search results of bookmarks in the Library window (link to view/open containing folder, parent folder button)",normal
Dragging a folder from the Library to browser content or location bar results in strange effects,normal
"New Places queries (aka smart folders, aka smart bookmarks) don't take effect until new window / restart",major
"""Bookmark this paragraph"", remembering scroll position",normal
History By Date is not *really* By Date,normal
Star Panel Folder Drop Down List is to Narrow to Completely Display Bookmarks Toolbar and Unsorted Bookmarks (truncated),normal
Bookmark details persist during search,normal
Support canonical URL with one-click bookmarking,normal
[Mac] No context menu for bookmarks from native menubar,normal
Dragging & dropping bookmarks into nautilus doesn't work,normal
Pass in parentId if we have it to avoid extra db lookups,normal
(Option to) always sort by name,normal
Bookmarking long URLs (/javascript) are truncated without warning,normal
"Move ""View Bookmarks Toolbar"" to the Bookmarks Toolbar sub-menu",normal
Unable to drop bookmarks onto folder in right panel if a column is sorted,normal
Double clicking in an empty area in the Bookmarks Library loads the selected bookmark,normal
query folders dragged from bookmarks toolbar overflow to visible toolbar get borked,normal
Clicking a bookmark from the bookmarks toolbar WHILE opening a new tab will change to the bookmarked site without being able to return to the originally targeted site ('Go back one page' button is greyed out).,minor
Bookmarks are added at the beginning of the list after performing sync,normal
Remove workarounds for bug 803255 once it's fixed,normal
[meta] Incremental two-phase bookmark sync for Android Sync,normal
Provide search functionality over bookmarks and their folders (from the bookmarks menu),normal
[Mac] Missing icons of Bookmarks Menu and Submenu when no windows opened (or library window is selected),trivial
make bookmarks toolbar the bookmark menu to simplify things like chrome,normal
'Illegal value' when calling method: [nsISessionStore::getClosedTabCount] when clicking History menu,trivial
bookmarks menu has too many separators,normal
Middle & right click in the bookmarks menu gives same result as left click,normal
Empty Show More Bookmarks Arrow on Toolbar cutting off Bookmarks,minor
favicon doesn't show up when a version is given in the url,normal
PlacesUtils.bookmarks is undefined when syncing,normal
Error decrypting record: No ciphertext: nothing to decrypt?,normal
"In bookmarks menu, no items can be dragged between 2 separators with nothing between them",normal
(Half-)Automatic updating of bookmark properties if website changes url,normal
remember sort order in history window,normal
[Linux] History  panel is not completely displayed after successive clicking on the history button.,normal
No way to sort bookmarks listed under tags,normal
Bookmark folder contents won't show up if their title is too long when looking in bookmark menus,normal
Bookmarks Menu collapses when collapsing a bookmark folder,normal
new bookmark loading tab does not grab URL,normal
Do not add default bookmarks for Marketplace and AMO in guest profiles,normal
[meta]Remove synchronous bookmarks API,normal
[UX] Design Spike: Incorporating a global history into Firefox,normal
New bookmarks sometimes go to the bottom of the list,normal
Selected menu item loses highlight,normal
"when i search history, i want to see the websites around it",normal
Addresses that resolve to a 301 should have their address updated to reflect new location,normal
We want a better bookmark manager!,normal
"Entry ""Open All in Tabs"" doesn't appear immediately once a folder gets 2 entries by dragging an item into it (requires closing and reopening the subfolder)",normal
Visit Count functionality is broken,normal
URLs are percent-encoded and therefore do not match bookmarked URLs. Pages are also bookmarked with percent-encoded URLs.,normal
Consider re-enabling title-editing for folder shortcuts,normal
Firefox Sync mixes up sort order of bookmarks in Unsorted Bookmarks folder,normal
History sidebar: show visit date in tooltip,normal
Make bookmark UI work with full-page plugins,normal
Firefox does not warn when importing bookmark file that has bookmarklets,normal
Opening the context menu for a bookmark folder while another has still its submenu open does close the context menu,normal
"Bookmarks with about:reader locations are not shown at all in the ""Most Visited"" smart folder",normal
Submenu gets borked after all bookmarks in it are deleted,minor
"Context menu entry ""Sort By Name"" should be greyed out on folders with less than 2 bookmarks",minor
Right Click -> 'Bookmark All Tabs' shouldn't bookmark about:newtab pages,normal
Crash Bookmarks Menu: Script: chrome://browser/content/places/browserPlacesViews.js:271,normal
Copy & paste (or drag & drop) Bookmarks folder will fail between 2 instances of browser (aka profiles),normal
"""Import bookmarks and history"" should be disabled or warn if no data is available",normal
Opening the context menu on a bookmark does not cause the link on the bottom to vanish,normal
Broken folder tree in edit this bookmark menu,normal
Bookmarking a URL that redirects to something else results in a null bookmark,normal
[meta] Migrate reading list to bookmarks,normal
Open and delete bookmarks by ID instead of by URL when possible.,normal
Smart keyword bookmark created without favicon,minor
"Since very last update to 43.0.4 bookmarks display goes back to top after print preview of a selected bookmark, and the bookmark is no longer highlighted.",normal
Add sorting capability to bookmarks,normal
"Create a ""Recent bookmarks"" smart folder",normal
Add favicons to BookmarkScreenshotRow,normal
Right click and left click have the same behavior  when you use them on a bookmark site,normal
"When downloading a specific file, screenshots are added to bookmarks",normal
improve asian language support in bookmarks/history query and search results,normal
Consider adding bookmarks API method to get ID of standard/common folders,normal
Contextual hint about offline bookmarks is not displayed,normal
[meta] Make all bookmarks syncable,normal
Incremental sync follow up: database-backed bookmarks buffer,normal
"Add domains table, with domain_id FK in history/bookmarks (and combined)",normal
[meta] Speed and performance of importing bookmarks from JSON or HTML files is awful,major
fillBHTooltip should crop title and do better about determining whether title / url are different (maybe only for recently closed tabs),normal
"Bookmarks panel: extra button ""Open All in Tabs"" appears in bookmarks folders after switching to Customize",normal
Bookmarks sidebar scrolls up by 1 item after drag and drop of any item,normal
Cancel button doesn't work if I create new bookmark in more than 1 window,normal
